{
  "protocol_version": "q4d-bootstrap-v1",
  "revision": "11111111111111111111111111111111.22222222222222222222222222222222",
  "model_config_revision": "22222222222222222222222222222222",
  "providers": [
    {
      "id": "fixture",
      "type": "openai",
      "base_url": "http://localhost:11434/v1",
      "default_model": "fixture-model",
      "api_key": "fixture-model-private-key",
      "agent": {
        "enabled": true,
        "protocol": "openai-completions",
        "context_window": 8192,
        "max_output_tokens": 512
      }
    }
  ],
  "mcp": {
    "url": "http://mcp:8081/internal/mcp",
    "runtime_token": "fixture-mcp-token-0123456789-abcdef",
    "connect_timeout_ms": 5000,
    "tool_timeout_ms": 30000
  },
  "capability": {
    "issuer": "q4d-fixture",
    "algorithm": "Ed25519",
    "token_type": "q4d-run-capability-v1+jwt",
    "public_keys": {
      "key-1": "O2onvM62pC1io6jQKm8Nc2UyFXcd4kOmOsBIoYtZ2ik"
    }
  }
}
